{"schema_version":1,"project":{"name":"[Unsaved project]","path":"","save_dirty":true,"project_change_count":22},"tracks":[{"guid":"{DB7F23BB-38B6-3844-8A87-22FD017EE05B}","index":0,"name":"Vox 2","color":{"red":12,"green":34,"blue":56},"folder_depth":0,"item_count":0,"fx_count":0},{"guid":"{771C2680-B9FA-2B48-AD94-ADFFA0A2A90C}","index":1,"name":"DRUM BUS","color":null,"folder_depth":0,"item_count":0,"fx_count":0}],"markers":[{"enumeration_index":0,"id":1,"is_region":false,"position_seconds":10,"name":"chorus","color":{"red":12,"green":34,"blue":56}},{"enumeration_index":1,"id":2,"is_region":false,"position_seconds":10,"name":"chorus","color":{"red":12,"green":34,"blue":56}},{"enumeration_index":2,"id":3,"is_region":false,"position_seconds":10,"name":"","color":null},{"enumeration_index":3,"id":4,"is_region":false,"position_seconds":10.000500000000001,"name":"chorus","color":{"red":12,"green":34,"blue":56}},{"enumeration_index":4,"id":5,"is_region":false,"position_seconds":10.000999999999999,"name":"chorus","color":{"red":12,"green":34,"blue":56}},{"enumeration_index":5,"id":101,"is_region":false,"position_seconds":20,"name":"Verse","color":{"red":12,"green":34,"blue":56}},{"enumeration_index":6,"id":202,"is_region":true,"position_seconds":30,"end_seconds":40,"name":"chorus 2","color":{"red":12,"green":34,"blue":56}},{"enumeration_index":7,"id":303,"is_region":false,"position_seconds":50,"name":"Shared ID marker","color":null},{"enumeration_index":8,"id":303,"is_region":true,"position_seconds":60,"end_seconds":70,"name":"Shared ID region","color":null}]}
